{
  "id": "roadmap",
  "version": "2.0.0",
  "audience": [
    "programme",
    "portfolio"
  ],
  "max_detail": "decision",
  "mandatory_sections": [
    "Objectives",
    "Waves",
    "Dependencies",
    "Milestones",
    "Risks",
    "Benefits"
  ],
  "mandatory_semantic_fields": [
    "claims",
    "decisions",
    "risks",
    "traceability"
  ],
  "formats": [
    "pptx",
    "xlsx",
    "html"
  ],
  "supported_diagrams": [
    "architecture",
    "flow",
    "roadmap",
    "risk",
    "dependency"
  ],
  "table_types": [
    "decision",
    "risk",
    "traceability",
    "action",
    "inventory"
  ],
  "executive_summary": {
    "required": true,
    "max_words": 300
  },
  "document_control": {
    "required": true
  },
  "classification": {
    "required": true
  },
  "approval_block": {
    "required": true
  },
  "branding": {
    "theme": "enterprise-default"
  },
  "accessibility": {
    "min_font_pt": 10,
    "require_alt_text_for_meaningful_images": true
  }
}
